[
  {
    "id": "APP-001",
    "title": "Native universal SwiftUI app",
    "spec_section": "Sections 1 and 26",
    "visual_references": [],
    "implementation_files": [
      "LifeGrid.xcodeproj/project.pbxproj",
      "LifeGrid/App"
    ],
    "test_files": [
      "LifeGridTests/FoundationSmokeTests.swift",
      "LifeGridUITests/LifeGridUITests.swift"
    ],
    "evidence_files": [
      "reviews/architecture/architecture-summary.md",
      "reviews/architecture/dependency-map.md",
      "reports/test-results/phase1-iphone-build.xcresult",
      "reports/test-results/phase1-ipad-build.xcresult",
      "reports/test-results/phase1-verification.md"
    ],
    "status": "verified",
    "architecture_relevant": true,
    "planned_implementation": [
      "LifeGrid.xcodeproj/project.pbxproj",
      "LifeGrid/App"
    ],
    "planned_tests": [
      "LifeGridTests/FoundationSmokeTests.swift",
      "LifeGridUITests/LifeGridUITests.swift"
    ],
    "approved_variance": null,
    "change_request": null
  },
  {
    "id": "APP-002",
    "title": "Local-only operation",
    "spec_section": "Sections 1 and 26",
    "visual_references": [],
    "implementation_files": [
      "LifeGrid.xcodeproj/project.pbxproj",
      "LifeGrid/App"
    ],
    "test_files": [
      "LifeGridTests/FoundationSmokeTests.swift",
      "LifeGridUITests/LifeGridUITests.swift"
    ],
    "evidence_files": [
      "reviews/architecture/architecture-summary.md",
      "reviews/architecture/dependency-map.md",
      "reports/test-results/phase1-iphone-build.xcresult",
      "reports/test-results/phase1-ipad-build.xcresult",
      "reports/test-results/phase1-verification.md"
    ],
    "status": "verified",
    "architecture_relevant": true,
    "planned_implementation": [
      "LifeGrid.xcodeproj/project.pbxproj",
      "LifeGrid/App"
    ],
    "planned_tests": [
      "LifeGridTests/FoundationSmokeTests.swift",
      "LifeGridUITests/LifeGridUITests.swift"
    ],
    "approved_variance": null,
    "change_request": null
  },
  {
    "id": "APP-003",
    "title": "iPhone and iPad support",
    "spec_section": "Sections 1 and 26",
    "visual_references": [],
    "implementation_files": [
      "LifeGrid.xcodeproj/project.pbxproj",
      "LifeGrid/App"
    ],
    "test_files": [
      "LifeGridTests/FoundationSmokeTests.swift",
      "LifeGridUITests/LifeGridUITests.swift"
    ],
    "evidence_files": [
      "reviews/architecture/architecture-summary.md",
      "reviews/architecture/dependency-map.md",
      "reports/test-results/phase1-iphone-build.xcresult",
      "reports/test-results/phase1-ipad-build.xcresult",
      "reports/test-results/phase1-verification.md"
    ],
    "status": "verified",
    "architecture_relevant": true,
    "planned_implementation": [
      "LifeGrid.xcodeproj/project.pbxproj",
      "LifeGrid/App"
    ],
    "planned_tests": [
      "LifeGridTests/FoundationSmokeTests.swift",
      "LifeGridUITests/LifeGridUITests.swift"
    ],
    "approved_variance": null,
    "change_request": null
  },
  {
    "id": "APP-004",
    "title": "Excluded capabilities remain absent",
    "spec_section": "Sections 1 and 26",
    "visual_references": [],
    "implementation_files": [
      "LifeGrid.xcodeproj/project.pbxproj",
      "LifeGrid/App"
    ],
    "test_files": [
      "LifeGridTests/FoundationSmokeTests.swift",
      "LifeGridUITests/LifeGridUITests.swift"
    ],
    "evidence_files": [
      "reviews/architecture/architecture-summary.md",
      "reviews/architecture/dependency-map.md",
      "reports/test-results/phase1-iphone-build.xcresult",
      "reports/test-results/phase1-ipad-build.xcresult",
      "reports/test-results/phase1-verification.md"
    ],
    "status": "verified",
    "architecture_relevant": true,
    "planned_implementation": [
      "LifeGrid.xcodeproj/project.pbxproj",
      "LifeGrid/App"
    ],
    "planned_tests": [
      "LifeGridTests/FoundationSmokeTests.swift",
      "LifeGridUITests/LifeGridUITests.swift"
    ],
    "approved_variance": null,
    "change_request": null
  },
  {
    "id": "NAV-001",
    "title": "Four-tab bottom navigation",
    "spec_section": "Section 2",
    "visual_references": [],
    "implementation_files": [
      "LifeGrid/App/LifeGridRootView.swift"
    ],
    "test_files": [
      "LifeGridUITests/LifeGridUITests.swift"
    ],
    "evidence_files": [
      "reports/test-results/phase2-tests.xcresult",
      "reports/test-results/phase2-new-game-iphone.png",
      "reports/test-results/phase2-new-game-ipad.png",
      "reports/test-results/phase2-verification.md"
    ],
    "status": "verified",
    "architecture_relevant": false,
    "planned_implementation": [
      "LifeGrid/App/LifeGridRootView.swift"
    ],
    "planned_tests": [
      "LifeGridUITests/LifeGridUITests.swift"
    ],
    "approved_variance": null,
    "change_request": null
  },
  {
    "id": "NAV-002",
    "title": "Resume active game on launch",
    "spec_section": "Section 2",
    "visual_references": [],
    "implementation_files": [
      "LifeGrid/App/LifeGridRootView.swift",
      "LifeGrid/App/AppStateStore.swift",
      "LifeGrid/Features/Game/ActiveGameSummaryScreen.swift",
      "LifeGrid/Persistence/JSONAppStateRepository.swift"
    ],
    "test_files": [
      "LifeGridTests/App/AppStateStoreTests.swift",
      "LifeGridTests/Persistence/JSONAppStateRepositoryTests.swift",
      "LifeGridUITests/LifeGridUITests.swift"
    ],
    "evidence_files": [
      "reports/test-results/phase2-tests.xcresult",
      "reports/test-results/phase2-active-game-iphone.png",
      "reports/test-results/phase2-verification.md"
    ],
    "status": "verified",
    "architecture_relevant": false,
    "planned_implementation": [
      "LifeGrid/App/LifeGridRootView.swift",
      "LifeGrid/App/AppStateStore.swift",
      "LifeGrid/Features/Game/ActiveGameSummaryScreen.swift",
      "LifeGrid/Persistence/JSONAppStateRepository.swift"
    ],
    "planned_tests": [
      "LifeGridTests/App/AppStateStoreTests.swift",
      "LifeGridTests/Persistence/JSONAppStateRepositoryTests.swift",
      "LifeGridUITests/LifeGridUITests.swift"
    ],
    "approved_variance": null,
    "change_request": null
  },
  {
    "id": "NEW-001",
    "title": "Total player selection",
    "spec_section": "Section 8",
    "visual_references": [
      "new-game"
    ],
    "implementation_files": [
      "LifeGrid/Features/NewGame/NewGameDraft.swift",
      "LifeGrid/Features/NewGame/NewGameScreen.swift"
    ],
    "test_files": [
      "LifeGridTests/Features/NewGame/NewGameDraftTests.swift",
      "LifeGridUITests/LifeGridUITests.swift"
    ],
    "evidence_files": [
      "reviews/visuals/new-game/phase2-comparison.md",
      "reports/test-results/phase2-tests.xcresult",
      "reports/test-results/phase2-new-game-iphone.png",
      "reports/test-results/phase2-verification.md"
    ],
    "status": "verified",
    "architecture_relevant": false,
    "planned_implementation": [
      "LifeGrid/Features/NewGame/NewGameDraft.swift",
      "LifeGrid/Features/NewGame/NewGameScreen.swift"
    ],
    "planned_tests": [
      "LifeGridTests/Features/NewGame/NewGameDraftTests.swift",
      "LifeGridUITests/LifeGridUITests.swift"
    ],
    "approved_variance": null,
    "change_request": null
  },
  {
    "id": "NEW-002",
    "title": "Starting life presets and custom value",
    "spec_section": "Section 8",
    "visual_references": [
      "new-game"
    ],
    "implementation_files": [
      "LifeGrid/Features/NewGame/StartingLifeInput.swift",
      "LifeGrid/Features/NewGame/NewGameDraft.swift",
      "LifeGrid/Shared/Components/StartingLifePicker.swift",
      "LifeGrid/Features/NewGame/NewGameScreen.swift",
      "LifeGrid/Features/Settings/SettingsScreen.swift"
    ],
    "test_files": [
      "LifeGridTests/Features/NewGame/StartingLifeInputTests.swift",
      "LifeGridTests/Features/NewGame/NewGameDraftTests.swift",
      "LifeGridTests/App/AppStateStoreTests.swift",
      "LifeGridUITests/LifeGridUITests.swift"
    ],
    "evidence_files": [
      "changes/CR-001-default-starting-life.md",
      "reviews/visuals/new-game/phase2-comparison.md",
      "reviews/visuals/settings/phase2-default-life-variance.md",
      "reports/test-results/phase2-tests.xcresult",
      "reports/test-results/phase2-new-game-iphone.png",
      "reports/test-results/phase2-settings-default-life-iphone.png",
      "reports/test-results/phase2-verification.md"
    ],
    "status": "verified",
    "architecture_relevant": false,
    "planned_implementation": [
      "LifeGrid/Features/NewGame/StartingLifeInput.swift",
      "LifeGrid/Features/NewGame/NewGameDraft.swift",
      "LifeGrid/Shared/Components/StartingLifePicker.swift",
      "LifeGrid/Features/NewGame/NewGameScreen.swift",
      "LifeGrid/Features/Settings/SettingsScreen.swift"
    ],
    "planned_tests": [
      "LifeGridTests/Features/NewGame/StartingLifeInputTests.swift",
      "LifeGridTests/Features/NewGame/NewGameDraftTests.swift",
      "LifeGridTests/App/AppStateStoreTests.swift",
      "LifeGridUITests/LifeGridUITests.swift"
    ],
    "approved_variance": "Settings owns Default Starting Life and updates only the remembered setup life field, never an active game.",
    "change_request": "changes/CR-001-default-starting-life.md"
  },
  {
    "id": "NEW-003",
    "title": "Optional opponent names",
    "spec_section": "Section 8",
    "visual_references": [
      "new-game"
    ],
    "implementation_files": [
      "LifeGrid/Features/NewGame/NewGameDraft.swift",
      "LifeGrid/Features/NewGame/NewGameScreen.swift"
    ],
    "test_files": [
      "LifeGridTests/Features/NewGame/NewGameDraftTests.swift",
      "LifeGridUITests/LifeGridUITests.swift"
    ],
    "evidence_files": [
      "reviews/visuals/new-game/phase2-comparison.md",
      "reports/test-results/phase2-tests.xcresult",
      "reports/test-results/phase2-new-game-iphone.png",